[
  {
    "interaction_id": "int_00001",
    "session_id": "session_candidate_001",
    "candidate_id": "candidate_001",
    "company_id": "company_002",
    "job_id": "job_012",
    "position": 1,
    "event_type": "impression",
    "relevance": 0
  },
  {
    "interaction_id": "int_00002",
    "session_id": "session_candidate_001",
    "candidate_id": "candidate_001",
    "company_id": "company_005",
    "job_id": "job_015",
    "position": 2,
    "event_type": "click",
    "relevance": 2
  },
  {
    "interaction_id": "int_00003",
    "session_id": "session_candidate_001",
    "candidate_id": "candidate_001",
    "company_id": "company_007",
    "job_id": "job_017",
    "position": 3,
    "event_type": "click",
    "relevance": 1
  },
  {
    "interaction_id": "int_00004",
    "session_id": "session_candidate_001",
    "candidate_id": "candidate_001",
    "company_id": "company_009",
    "job_id": "job_019",
    "position": 4,
    "event_type": "click",
    "relevance": 1
  },
  {
    "interaction_id": "int_00005",
    "session_id": "session_candidate_001",
    "candidate_id": "candidate_001",
    "company_id": "company_004",
    "job_id": "job_004",
    "position": 5,
    "event_type": "click",
    "relevance": 2
  },
  {
    "interaction_id": "int_00006",
    "session_id": "session_candidate_001",
    "candidate_id": "candidate_001",
    "company_id": "company_006",
    "job_id": "job_016",
    "position": 6,
    "event_type": "click",
    "relevance": 2
  },
  {
    "interaction_id": "int_00007",
    "session_id": "session_candidate_001",
    "candidate_id": "candidate_001",
    "company_id": "company_008",
    "job_id": "job_018",
    "position": 7,
    "event_type": "click",
    "relevance": 1
  },
  {
    "interaction_id": "int_00008",
    "session_id": "session_candidate_001",
    "candidate_id": "candidate_001",
    "company_id": "company_002",
    "job_id": "job_002",
    "position": 8,
    "event_type": "click",
    "relevance": 1
  },
  {
    "interaction_id": "int_00009",
    "session_id": "session_candidate_001",
    "candidate_id": "candidate_001",
    "company_id": "company_006",
    "job_id": "job_006",
    "position": 9,
    "event_type": "click",
    "relevance": 1
  },
  {
    "interaction_id": "int_00010",
    "session_id": "session_candidate_001",
    "candidate_id": "candidate_001",
    "company_id": "company_001",
    "job_id": "job_001",
    "position": 10,
    "event_type": "apply",
    "relevance": 3
  },
  {
    "interaction_id": "int_00011",
    "session_id": "session_candidate_001",
    "candidate_id": "candidate_001",
    "company_id": "company_010",
    "job_id": "job_010",
    "position": 11,
    "event_type": "click",
    "relevance": 2
  },
  {
    "interaction_id": "int_00012",
    "session_id": "session_candidate_001",
    "candidate_id": "candidate_001",
    "company_id": "company_009",
    "job_id": "job_009",
    "position": 12,
    "event_type": "click",
    "relevance": 1
  },
  {
    "interaction_id": "int_00013",
    "session_id": "session_candidate_001",
    "candidate_id": "candidate_001",
    "company_id": "company_004",
    "job_id": "job_014",
    "position": 13,
    "event_type": "click",
    "relevance": 1
  },
  {
    "interaction_id": "int_00014",
    "session_id": "session_candidate_001",
    "candidate_id": "candidate_001",
    "company_id": "company_005",
    "job_id": "job_005",
    "position": 14,
    "event_type": "click",
    "relevance": 1
  },
  {
    "interaction_id": "int_00015",
    "session_id": "session_candidate_001",
    "candidate_id": "candidate_001",
    "company_id": "company_003",
    "job_id": "job_013",
    "position": 15,
    "event_type": "click",
    "relevance": 2
  },
  {
    "interaction_id": "int_00016",
    "session_id": "session_candidate_001",
    "candidate_id": "candidate_001",
    "company_id": "company_001",
    "job_id": "job_011",
    "position": 16,
    "event_type": "click",
    "relevance": 1
  },
  {
    "interaction_id": "int_00017",
    "session_id": "session_candidate_002",
    "candidate_id": "candidate_002",
    "company_id": "company_003",
    "job_id": "job_003",
    "position": 1,
    "event_type": "click",
    "relevance": 2
  },
  {
    "interaction_id": "int_00018",
    "session_id": "session_candidate_002",
    "candidate_id": "candidate_002",
    "company_id": "company_002",
    "job_id": "job_002",
    "position": 2,
    "event_type": "click",
    "relevance": 2
  },
  {
    "interaction_id": "int_00019",
    "session_id": "session_candidate_002",
    "candidate_id": "candidate_002",
    "company_id": "company_008",
    "job_id": "job_008",
    "position": 3,
    "event_type": "click",
    "relevance": 2
  },
  {
    "interaction_id": "int_00020",
    "session_id": "session_candidate_002",
    "candidate_id": "candidate_002",
    "company_id": "company_010",
    "job_id": "job_020",
    "position": 4,
    "event_type": "click",
    "relevance": 2
  },
  {
    "interaction_id": "int_00021",
    "session_id": "session_candidate_002",
    "candidate_id": "candidate_002",
    "company_id": "company_009",
    "job_id": "job_019",
    "position": 5,
    "event_type": "impression",
    "relevance": 0
  },
  {
    "interaction_id": "int_00022",
    "session_id": "session_candidate_002",
    "candidate_id": "candidate_002",
    "company_id": "company_004",
    "job_id": "job_014",
    "position": 6,
    "event_type": "click",
    "relevance": 2
  },
  {
    "interaction_id": "int_00023",
    "session_id": "session_candidate_002",
    "candidate_id": "candidate_002",
    "company_id": "company_006",
    "job_id": "job_006",
    "position": 7,
    "event_type": "impression",
    "relevance": 0
  },
  {
    "interaction_id": "int_00024",
    "session_id": "session_candidate_002",
    "candidate_id": "candidate_002",
    "company_id": "company_006",
    "job_id": "job_016",
    "position": 8,
    "event_type": "click",
    "relevance": 2
  },
  {
    "interaction_id": "int_00025",
    "session_id": "session_candidate_002",
    "candidate_id": "candidate_002",
    "company_id": "company_009",
    "job_id": "job_009",
    "position": 9,
    "event_type": "impression",
    "relevance": 0
  },
  {
    "interaction_id": "int_00026",
    "session_id": "session_candidate_002",
    "candidate_id": "candidate_002",
    "company_id": "company_004",
    "job_id": "job_004",
    "position": 10,
    "event_type": "impression",
    "relevance": 0
  },
  {
    "interaction_id": "int_00027",
    "session_id": "session_candidate_002",
    "candidate_id": "candidate_002",
    "company_id": "company_005",
    "job_id": "job_005",
    "position": 11,
    "event_type": "click",
    "relevance": 2
  },
  {
    "interaction_id": "int_00028",
    "session_id": "session_candidate_002",
    "candidate_id": "candidate_002",
    "company_id": "company_008",
    "job_id": "job_018",
    "position": 12,
    "event_type": "impression",
    "relevance": 0
  },
  {
    "interaction_id": "int_00029",
    "session_id": "session_candidate_002",
    "candidate_id": "candidate_002",
    "company_id": "company_001",
    "job_id": "job_011",
    "position": 13,
    "event_type": "click",
    "relevance": 1
  },
  {
    "interaction_id": "int_00030",
    "session_id": "session_candidate_002",
    "candidate_id": "candidate_002",
    "company_id": "company_010",
    "job_id": "job_010",
    "position": 14,
    "event_type": "click",
    "relevance": 1
  },
  {
    "interaction_id": "int_00031",
    "session_id": "session_candidate_002",
    "candidate_id": "candidate_002",
    "company_id": "company_003",
    "job_id": "job_013",
    "position": 15,
    "event_type": "click",
    "relevance": 1
  },
  {
    "interaction_id": "int_00032",
    "session_id": "session_candidate_002",
    "candidate_id": "candidate_002",
    "company_id": "company_007",
    "job_id": "job_007",
    "position": 16,
    "event_type": "click",
    "relevance": 1
  },
  {
    "interaction_id": "int_00033",
    "session_id": "session_candidate_003",
    "candidate_id": "candidate_003",
    "company_id": "company_009",
    "job_id": "job_019",
    "position": 1,
    "event_type": "click",
    "relevance": 1
  },
  {
    "interaction_id": "int_00034",
    "session_id": "session_candidate_003",
    "candidate_id": "candidate_003",
    "company_id": "company_006",
    "job_id": "job_016",
    "position": 2,
    "event_type": "click",
    "relevance": 1
  },
  {
    "interaction_id": "int_00035",
    "session_id": "session_candidate_003",
    "candidate_id": "candidate_003",
    "company_id": "company_008",
    "job_id": "job_008",
    "position": 3,
    "event_type": "apply",
    "relevance": 3
  },
  {
    "interaction_id": "int_00036",
    "session_id": "session_candidate_003",
    "candidate_id": "candidate_003",
    "company_id": "company_010",
    "job_id": "job_020",
    "position": 4,
    "event_type": "click",
    "relevance": 1
  },
  {
    "interaction_id": "int_00037",
    "session_id": "session_candidate_003",
    "candidate_id": "candidate_003",
    "company_id": "company_004",
    "job_id": "job_014",
    "position": 5,
    "event_type": "click",
    "relevance": 1
  },
  {
    "interaction_id": "int_00038",
    "session_id": "session_candidate_003",
    "candidate_id": "candidate_003",
    "company_id": "company_004",
    "job_id": "job_004",
    "position": 6,
    "event_type": "impression",
    "relevance": 0
  },
  {
    "interaction_id": "int_00039",
    "session_id": "session_candidate_003",
    "candidate_id": "candidate_003",
    "company_id": "company_002",
    "job_id": "job_002",
    "position": 7,
    "event_type": "click",
    "relevance": 2
  },
  {
    "interaction_id": "int_00040",
    "session_id": "session_candidate_003",
    "candidate_id": "candidate_003",
    "company_id": "company_007",
    "job_id": "job_017",
    "position": 8,
    "event_type": "click",
    "relevance": 1
  },
  {
    "interaction_id": "int_00041",